{
  "kit-version": 1,
  "name": "mcppls-kit-libcxx-23.1.0-x86_64-unknown-linux-gnu",
  "target": "x86_64-unknown-linux-gnu",
  "stdlib": {
    "name": "libc++",
    "version": "23.1.0",
    "module-metadata": "lib/x86_64-unknown-linux-gnu/libc++.modules.json"
  },
  "system-include-directories": [
    "include/c++/v1",
    "include/x86_64-unknown-linux-gnu/c++/v1"
  ],
  "sysroot": "sysroot",
  "arguments": [
    "-nostdinc++"
  ],
  "licenses": [
    "licenses/LLVM-LICENSE.TXT",
    "licenses/libc6-dev-copyright.txt",
    "licenses/linux-libc-dev-copyright.txt"
  ]
}
